No.,Use Case ID,Use Case Name,Actor,Description,Preconditions,Main Flow,Alternate Flow,Postconditions,Related Req.,Priority,Status
45,UC-45,Create New Map with Visual Designer,Admin,Admin creates a new map using the visual map designer with terrain tiles and grid editing,Admin is authenticated and has map management permissions,"1. Navigate to Map Management → 2. Click Create New button → 3. Open Map Designer Page → 4. Select terrain assets from workspace → 5. Design map grid with terrain tiles (grass, water, wood, roads, crossroads) → 6. Configure map information (title min 5 chars, description min 10 chars) → 7. Preview map in orthogonal or isometric view → 8. Validate map configuration → 9. Submit creation → 10. System saves map with JSON configuration → 11. Show success message",Title less than 5 chars → show validation error | Description less than 10 chars → show validation error | Invalid terrain configuration → show error,New map created with visual grid and JSON configuration,"FR-53, FR-54, FR-55, FR-56, FR-57, FR-58, FR-59",High,Approved
46,UC-46,View Map List with Advanced Filtering,Admin,Admin views paginated list of maps with comprehensive search and filter capabilities,Admin is authenticated,"1. Navigate to Map Management → 2. View map list → 3. Apply filters (search, sort by title/creation/updates/challenges count/courses count, sort direction, status) → 4. Browse paginated results → 5. View map details with statistics",No maps found → show empty state | Network error → show retry option | Invalid filter → show error message,Map list displayed with current filter applied,"FR-60, FR-61",High,Approved
47,UC-47,View Map Details and Preview,Admin,Admin views detailed information and visual preview of a specific map,Admin is authenticated and map exists,"1. Navigate to Map Management → 2. Find map in list → 3. Click View Details button → 4. View complete map information → 5. See visual map preview with terrain tiles → 6. View usage statistics (challenges count, courses count) → 7. View creation metadata",Map not found → show error message | Access denied → show permission error,Map details and visual preview displayed,FR-62,Medium,Approved
48,UC-48,Update Map with Visual Designer,Admin,Admin modifies existing map using the visual map designer with complex grid editing,Admin is authenticated and map exists and is not deleted,"1. Navigate to Map Management → 2. Find map in list → 3. Click Edit button → 4. Load existing map data into designer → 5. Modify terrain tiles and grid configuration → 6. Update map information (title, description) → 7. Preview changes in real-time → 8. Validate updated configuration → 9. Show update confirmation dialog → 10. Submit updates → 11. System saves changes → 12. Show success message",Map not found → show error | Validation failed → show specific errors | Update conflict → show warning | Map deleted → deny access | Invalid terrain configuration → show error,Map updated with new visual configuration in system,"FR-53, FR-54, FR-55, FR-56, FR-57, FR-58, FR-59",High,Approved
49,UC-49,Delete Map,Admin,Admin marks a map as deleted (soft delete) without permanent removal,Admin is authenticated and map exists and is not already deleted,1. Navigate to Map Management → 2. Find map in list → 3. Click Delete button → 4. System shows confirmation dialog → 5. Confirm deletion → 6. System marks map as deleted → 7. Show success message → 8. Refresh list,Confirmation cancelled → abort operation | Delete failed → show error message,Map marked as deleted and hidden from normal view,FR-63,Medium,Approved
50,UC-50,Restore Deleted Map,Admin,Admin restores a previously deleted map back to active status,Admin is authenticated and map exists and is marked as deleted,1. Navigate to Map Management → 2. Set filter to show deleted maps → 3. Find deleted map → 4. Click Restore button → 5. System shows confirmation → 6. Confirm restore → 7. System marks map as active → 8. Show success message → 9. Refresh list,Map not found → show error | Restore failed → show error message | Confirmation cancelled → abort operation,Map restored to active status and visible in normal list,FR-63,Medium,Approved
51,UC-51,Create New Robot Product,Admin,Admin creates a new robot product with detailed specifications and information,Admin is authenticated and has robot management permissions,"1. Navigate to Robot Management → 2. Click Create New button → 3. Fill robot form (name, model, brand, description, image URL, technical specs, requirements, age range) → 4. Validate form data → 5. Submit creation → 6. System saves robot → 7. Show success message → 8. Redirect to robot list",Empty required fields → show validation errors | Invalid image URL → show error | Invalid age range → show validation error | Age range conflict → show error,New robot product created and appears in robot list,"FR-64, FR-65, FR-66, FR-67, FR-68",High,Approved
52,UC-52,View Robot List with Search,Admin,Admin views paginated list of robot products with search functionality,Admin is authenticated,1. Navigate to Robot Management → 2. View robot list → 3. Use search by robot name → 4. Browse paginated results → 5. View robot summary information,No robots found → show empty state | Network error → show retry option | Invalid search → show error message,Robot list displayed with current search applied,"FR-69, FR-70",High,Approved
53,UC-53,View Robot Details,Admin,Admin views detailed information of a specific robot product,Admin is authenticated and robot exists,1. Navigate to Robot Management → 2. Find robot in list → 3. Click View Details button → 4. View complete robot information → 5. View robot images and components → 6. See technical specifications and requirements,Robot not found → show error message | Access denied → show permission error,Robot details displayed with full information,"FR-71, FR-72",Medium,Approved
54,UC-54,Update Robot Product Information,Admin,Admin modifies existing robot product information and specifications,Admin is authenticated and robot exists,1. Navigate to Robot Management → 2. Find robot in list → 3. Click Edit button → 4. Load existing robot data → 5. Modify form fields → 6. Validate changes → 7. Submit updates → 8. System saves changes → 9. Show success message,Robot not found → show error | Validation failed → show specific errors | Update conflict → show warning,Robot information updated in system,"FR-64, FR-65, FR-66, FR-67, FR-68",High,Approved
55,UC-55,Delete Robot Product,Admin,Admin removes a robot product from the system,Admin is authenticated and robot exists,1. Navigate to Robot Management → 2. Find robot in list → 3. Click Delete button → 4. System shows confirmation dialog → 5. Confirm deletion → 6. System removes robot → 7. Show success message → 8. Refresh list,Confirmation cancelled → abort operation | Delete failed → show error message,Robot removed from system and no longer appears in list,FR-73,Medium,Approved
56,UC-56,Manage Robot Components,Admin,Admin adds and manages components associated with a robot product,Admin is authenticated and robot exists,1. Navigate to Robot Details → 2. Go to Components tab → 3. Add new component with quantity → 4. Edit existing component quantities → 5. Remove components from robot → 6. Validate component data → 7. Save changes → 8. System updates robot component list,Invalid component selection → show error | Invalid quantity → show validation error | Component already exists → show conflict warning,Robot component list updated with new associations,"FR-74, FR-75",Medium,Approved
57,UC-57,Create New Component,Admin,Admin creates a new component with specifications and technical details,Admin is authenticated and has component management permissions,"1. Navigate to Component Management → 2. Click Create New button → 3. Fill component form (name, description, type, image URL, specifications) → 4. Validate form data → 5. Submit creation → 6. System saves component → 7. Show success message → 8. Redirect to component list",Empty required fields → show validation errors | Invalid image URL → show error | Invalid component type → show validation error,New component created and appears in component list,"FR-76, FR-77, FR-78, FR-79, FR-80",High,Approved
58,UC-58,View Component List with Search and Filter,Admin,Admin views paginated list of components with search and type filter capabilities,Admin is authenticated,"1. Navigate to Component Management → 2. View component list → 3. Use search by component name → 4. Filter by component type (Sensor, Actuator, Controller, etc.) → 5. Browse paginated results → 6. View component summary information",No components found → show empty state | Network error → show retry option | Invalid search/filter → show error message,Component list displayed with current search and filter applied,"FR-81, FR-82",High,Approved
59,UC-59,View Component Details,Admin,Admin views detailed information of a specific component,Admin is authenticated and component exists,1. Navigate to Component Management → 2. Find component in list → 3. Click View Details button → 4. View complete component information → 5. See technical specifications and descriptions → 6. View external purchase links,Component not found → show error message | Access denied → show permission error,Component details displayed with full technical information,"FR-83, FR-84",Medium,Approved
60,UC-60,Update Component Information,Admin,Admin modifies existing component information and specifications,Admin is authenticated and component exists,1. Navigate to Component Management → 2. Find component in list → 3. Click Edit button → 4. Load existing component data → 5. Modify form fields → 6. Validate changes → 7. Submit updates → 8. System saves changes → 9. Show success message,Component not found → show error | Validation failed → show specific errors | Update conflict → show warning,Component information updated in system,"FR-76, FR-77, FR-78, FR-79, FR-80",High,Approved
61,UC-61,Delete Component,Admin,Admin removes a component from the system,Admin is authenticated and component exists,1. Navigate to Component Management → 2. Find component in list → 3. Click Delete button → 4. System shows confirmation dialog → 5. Confirm deletion → 6. System removes component → 7. Show success message → 8. Refresh list,Confirmation cancelled → abort operation | Delete failed → show error message,Component removed from system and no longer appears in list,FR-85,Medium,Approved
62,UC-62,Create Batch of Activation Codes,Admin,Admin creates a batch of robot activation codes for a specific robot,Admin is authenticated and has activation code management permissions,1. Navigate to Activation Code Management → 2. Click Create Batch button → 3. Select robot from dropdown → 4. Enter batch ID → 5. Set quantity (≥1) → 6. Set expiry date (optional) → 7. Validate form data → 8. Submit creation → 9. System generates codes → 10. Show success message → 11. Redirect to code list,Invalid robot selection → show error | Empty batch ID → show validation error | Invalid quantity → show error | Invalid date → show format error,Batch of activation codes created and available for use,"FR-85, FR-86",High,Approved
63,UC-63,View Activation Code List,Admin,Admin views and manages list of all activation codes with pagination and filtering,Admin is authenticated,"1. Navigate to Activation Code Management → 2. System displays paginated table → 3. View code details (code, batch ID, robot name, status, dates, student) → 4. Use pagination controls → 5. Filter by status if needed → 6. View total count and current page",Loading error → show retry option | Empty list → show empty state message,Admin can view and monitor all activation codes,FR-87,High,Approved
64,UC-64,Copy Activation Code,Admin,Admin copies activation code to clipboard for sharing,Admin is authenticated and viewing code list,1. Click copy button next to code → 2. Code copied to clipboard → 3. Show confirmation message,Clipboard access denied → show error message,Activation code copied for easy sharing,FR-86,Medium,Approved
65,UC-65,Update Activation Code Status,Admin,"Admin updates status of activation codes (Active, Used, Expired, Revoked, Suspended)",Admin is authenticated and code exists,1. Click Edit Status button → 2. Select new status from dropdown → 3. Confirm status change → 4. System updates code status → 5. Show success message,Invalid status selection → show error | Code already used → prevent status change,Code status updated successfully,FR-89,High,Approved
66,UC-66,Export Activation Codes to CSV,Admin,Admin exports activation codes for specific batch to CSV file,Admin is authenticated,1. Click Export CSV button → 2. Enter batch ID → 3. Confirm export → 4. System generates CSV file → 5. Downloads file to local system,Invalid batch ID → show error | Export failed → show retry option,CSV file with activation codes downloaded,FR-90,Medium,Approved
67,UC-67,View Activation Code Details,Admin,Admin views detailed information of specific activation code,Admin is authenticated and code exists,"1. View code in table → 2. See all details (code, robot, batch, status, dates, student info) → 3. Check usage history if available",Code not found → show not found message,Complete activation code information displayed,FR-91,Medium,Approved
68,UC-68,Create New Certificate Template,Admin,Admin creates a new certificate template with HTML design and placeholder variables,Admin is authenticated and has certificate template management permissions,"1. Navigate to Certificate Template Management → 2. Click Create New button → 3. Select course from dropdown → 4. Fill template form (name, background image URL, HTML body with placeholders, issuer info, signature image) → 5. Configure active status → 6. Validate form data → 7. Submit creation → 8. System saves template → 9. Show success message → 10. Redirect to template list",Empty required fields → show validation errors | Invalid course selection → show error | Invalid HTML format → show error | Invalid image URLs → show format error,New certificate template created and available for use,"FR-92, FR-93",High,Approved
69,UC-69,View Certificate Template List,Admin,Admin views and manages list of all certificate templates with pagination and filtering,Admin is authenticated,"1. Navigate to Certificate Template Management → 2. System displays paginated table → 3. View template details (name, course, status, dates) → 4. Use pagination controls → 5. Filter by course and active status → 6. Search templates by name → 7. View total count and current page",Loading error → show retry option | Empty list → show empty state message,Admin can view and monitor all certificate templates,FR-94,High,Approved
70,UC-70,Edit Certificate Template,Admin,Admin updates certificate template design and configuration,Admin is authenticated and template exists,"1. Click Edit button on template → 2. Modify template form (name, HTML body, issuer info, images) → 3. Preview changes if needed → 4. Validate form data → 5. Submit updates → 6. System saves changes → 7. Show success message",Invalid HTML format → show error | Template in use → show warning | Invalid image URLs → show format error,Certificate template updated successfully,FR-95,High,Approved
71,UC-71,Preview Certificate Template,Admin,Admin previews how certificate template will look when issued,Admin is authenticated and template exists,1. Click Preview button on template → 2. System renders HTML template with sample data → 3. Show preview dialog with template design → 4. Close preview when done,Template rendering error → show error message | Missing placeholders → show warning,Certificate template preview displayed with sample data,FR-96,Medium,Approved
72,UC-72,Delete Certificate Template,Admin,Admin removes certificate template from system,Admin is authenticated and template exists,1. Click Delete button on template → 2. Confirm deletion dialog → 3. System removes template → 4. Show success message → 5. Update template list,Template in use → prevent deletion | Database error → show retry option,Certificate template deleted from system,FR-97,Medium,Approved
73,UC-73,View Certificate List,Admin,Admin views and manages list of all issued certificates with pagination and filtering,Admin is authenticated,"1. Navigate to Certificate Management → 2. System displays paginated table → 3. View certificate details (student, course, status, issue date, verification code) → 4. Use pagination controls → 5. Filter by status (Draft, Issued, Revoked, Expired) → 6. Search certificates by student or course → 7. View total count and current page",Loading error → show retry option | Empty list → show empty state message,Admin can view and monitor all certificates,FR-98,High,Approved
74,UC-74,View Certificate Details,Admin,Admin views detailed information of specific certificate including verification details,Admin is authenticated and certificate exists,"1. Click View button on certificate → 2. System displays certificate details dialog → 3. Show certificate information (student, course, template, dates, status, verification code) → 4. Close details when done",Certificate not found → show not found message,Complete certificate information displayed,FR-99,Medium,Approved
75,UC-75,Revoke Certificate,Admin,Admin revokes an issued certificate making it invalid,Admin is authenticated and certificate is issued,1. Click Revoke button on certificate → 2. Enter revocation reason → 3. Confirm revocation → 4. System updates certificate status to revoked → 5. Show success message,Certificate already revoked → show error | Invalid reason → show validation error,Certificate status updated to revoked with reason recorded,FR-100,High,Approved
76,UC-76,Delete Certificate,Admin,Admin removes certificate from system,Admin is authenticated and certificate exists,1. Click Delete button on certificate → 2. Confirm deletion dialog → 3. System removes certificate → 4. Show success message → 5. Update certificate list,Certificate already issued → prevent deletion | System error → show retry option,Certificate deleted from system,FR-102,Medium,Approved
77,UC-77,Create New Voucher,Admin,Admin creates a new voucher code with specific terms and conditions,Admin is authenticated and has voucher management permissions,"1. Navigate to Voucher Management → 2. Click Create New button → 3. Fill voucher form (code, name, description, type, discount value, min order amount, usage limits, date range) → 4. Validate form data → 5. Submit creation → 6. System saves voucher → 7. Show success message → 8. Redirect to voucher list",Empty required fields → show validation errors | Invalid voucher code format → show error | Invalid date range → show error | Duplicate code → show conflict warning,New voucher created and available for use,"FR-102, FR-103",High,Approved
78,UC-78,View Voucher List,Admin,Admin views and manages list of all vouchers with pagination and filtering,Admin is authenticated,"1. Navigate to Voucher Management → 2. System displays paginated table → 3. View voucher details (code, name, type, discount value, usage count, expiry, status) → 4. Use pagination controls → 5. Filter by date range and status → 6. Search vouchers by code or name → 7. View total count and current page",Loading error → show retry option | Empty list → show empty state message,Admin can view and monitor all vouchers,FR-104,High,Approved
79,UC-79,Edit Voucher,Admin,Admin updates voucher configuration and terms,Admin is authenticated and voucher exists,"1. Click Edit button on voucher → 2. Modify voucher form (name, description, discount value, limits, dates) → 3. Validate form data → 4. Submit updates → 5. System saves changes → 6. Show success message",Invalid form data → show validation errors | Voucher in use → show warning | Invalid date changes → show error,Voucher updated successfully,FR-105,High,Approved
80,UC-80,View Voucher Details,Admin,Admin views comprehensive voucher information and usage statistics,Admin is authenticated and voucher exists,"1. Click View Details button on voucher → 2. System displays voucher details page → 3. Show all voucher information (terms, usage stats, restrictions) → 4. Navigate back to list when done",Voucher not found → show not found message,Complete voucher information displayed,FR-106,Medium,Approved
81,UC-81,Delete Voucher,Admin,Admin removes voucher from system with soft delete functionality,Admin is authenticated and voucher exists,1. Click Delete button on voucher → 2. Confirm deletion dialog → 3. System marks voucher as deleted → 4. Show success message → 5. Update voucher list → 6. Voucher becomes unavailable for use,Voucher in active use → prevent deletion | System error → show retry option,Voucher marked as deleted and unavailable,FR-109,Medium,Approved
82,UC-82,Restore Voucher,Admin,Admin restores previously deleted voucher back to active state,Admin is authenticated and deleted voucher exists,1. Click Restore button on deleted voucher → 2. Confirm restoration dialog → 3. System marks voucher as active → 4. Show success message → 5. Update voucher list → 6. Voucher becomes available again,Restore fails → show error message | Voucher conflicts → show warning,Voucher restored and available for use,FR-110,Medium,Approved
83,UC-83,View Voucher Usage History,Admin,Admin tracks and monitors voucher usage across the system,Admin is authenticated,"1. Navigate to Voucher Usage tab → 2. System displays usage history table → 3. View usage details (user, voucher, order, usage date) → 4. Filter by date range → 5. Use pagination controls → 6. Click View Details for specific usage",No usage data → show empty state | Loading error → show retry option,Voucher usage history displayed with filtering,FR-107,High,Approved
84,UC-84,View Voucher Usage Details,Admin,Admin views detailed information about specific voucher usage transaction,Admin is authenticated and usage exists,"1. Click View Details on usage row → 2. System displays usage details dialog → 3. Show complete transaction info (user, order, discount amount, timestamps) → 4. Close details when done",Usage not found → show not found message,Detailed voucher usage information displayed,FR-108,Medium,Approved
85,UC-85,Create New Blog Post,Admin,"Admin creates a new blog post with content, tags, and metadata",Admin is authenticated and has blog management permissions,"1. Navigate to Blog Management → 2. Click Create New button → 3. Fill blog form (title, content, thumbnail URL, select tags) → 4. Validate form data → 5. Submit creation → 6. System saves blog → 7. Show success message → 8. Redirect to blog list",Empty required fields → show validation errors | Invalid title length → show error | Invalid thumbnail URL → show format error | Content too short → show validation error,New blog post created and published,"FR-111, FR-112",High,Approved
86,UC-86,View Blog List,Admin,Admin views and manages list of all blog posts with advanced filtering and search capabilities,Admin is authenticated,"1. Navigate to Blog Management → 2. System displays paginated table → 3. View blog details (title, author, view count, reading time, creation date, tags) → 4. Use pagination controls → 5. Search by title/content → 6. Filter by tags → 7. Use advanced filters (date range, view count, reading time) → 8. View total count and current page",Loading error → show retry option | Empty list → show empty state message,Admin can view and monitor all blog posts with comprehensive filtering,FR-113,High,Approved
87,UC-87,Edit Blog Post,Admin,"Admin updates blog post content, metadata, and tag associations",Admin is authenticated and blog exists,"1. Click Edit button on blog → 2. Modify blog form (title, content, thumbnail URL, tags) → 3. Validate form data → 4. Submit updates → 5. System saves changes → 6. Show success message",Invalid form data → show validation errors | Title too long → show error | Content validation fails → show error,Blog post updated successfully,FR-114,High,Approved
88,UC-88,View Blog Details,Admin,Admin views comprehensive blog post information and metadata,Admin is authenticated and blog exists,"1. Click View Details button on blog → 2. System displays blog details dialog → 3. Show all blog information (content, tags, stats, metadata) → 4. Close details when done",Blog not found → show not found message,Complete blog post information displayed,FR-115,Medium,Approved
89,UC-89,Delete Blog Post,Admin,Admin removes blog post from system with soft delete functionality,Admin is authenticated and blog exists,1. Click Delete button on blog → 2. Confirm deletion dialog → 3. System marks blog as deleted → 4. Show success message → 5. Update blog list → 6. Blog becomes unavailable publicly,Blog has active comments → show warning | System error → show retry option,Blog post marked as deleted and unavailable,FR-116,Medium,Approved
